{"$id":"urn:acme-firm:schema:scenario-catalog:1.0.0","$schema":"https://json-schema.org/draft/2020-12/schema","additionalProperties":false,"description":"Índice cerrado de dieciséis escenarios de entrada sin resultados embebidos.","properties":{"$schema":{"const":"../schemas/scenario_catalog.schema.json","type":"string"},"catalog_id":{"const":"SCENARIOS-16","type":"string"},"entries":{"items":{"additionalProperties":false,"properties":{"oracle_path":{"pattern":"^oracles/S(?:0[0-9]|1[0-5])\\.expected\\.json$","type":"string"},"scenario_id":{"pattern":"^S(?:0[0-9]|1[0-5])$","type":"string"},"scenario_path":{"pattern":"^scenarios/S(?:0[0-9]|1[0-5])\\.json$","type":"string"}},"required":["scenario_id","scenario_path","oracle_path"],"type":"object"},"maxItems":16,"minItems":16,"type":"array","uniqueItems":true,"x-ifm6-unique-by":["scenario_id","scenario_path","oracle_path"]},"expected_entry_count":{"const":16,"type":"integer"},"index_only":{"const":true,"type":"boolean"},"schema_version":{"const":"1.0.0","type":"string"},"source_of_truth":{"minLength":1,"type":"string"}},"required":["$schema","schema_version","catalog_id","expected_entry_count","index_only","source_of_truth","entries"],"title":"IFATIGUE-INFRA6-M6 scenario catalog contract","type":"object"}
