{"$schema":"../schemas/scenario_catalog.schema.json","catalog_id":"SCENARIOS-16","entries":[{"oracle_path":"oracles/S00.expected.json","scenario_id":"S00","scenario_path":"scenarios/S00.json"},{"oracle_path":"oracles/S01.expected.json","scenario_id":"S01","scenario_path":"scenarios/S01.json"},{"oracle_path":"oracles/S02.expected.json","scenario_id":"S02","scenario_path":"scenarios/S02.json"},{"oracle_path":"oracles/S03.expected.json","scenario_id":"S03","scenario_path":"scenarios/S03.json"},{"oracle_path":"oracles/S04.expected.json","scenario_id":"S04","scenario_path":"scenarios/S04.json"},{"oracle_path":"oracles/S05.expected.json","scenario_id":"S05","scenario_path":"scenarios/S05.json"},{"oracle_path":"oracles/S06.expected.json","scenario_id":"S06","scenario_path":"scenarios/S06.json"},{"oracle_path":"oracles/S07.expected.json","scenario_id":"S07","scenario_path":"scenarios/S07.json"},{"oracle_path":"oracles/S08.expected.json","scenario_id":"S08","scenario_path":"scenarios/S08.json"},{"oracle_path":"oracles/S09.expected.json","scenario_id":"S09","scenario_path":"scenarios/S09.json"},{"oracle_path":"oracles/S10.expected.json","scenario_id":"S10","scenario_path":"scenarios/S10.json"},{"oracle_path":"oracles/S11.expected.json","scenario_id":"S11","scenario_path":"scenarios/S11.json"},{"oracle_path":"oracles/S12.expected.json","scenario_id":"S12","scenario_path":"scenarios/S12.json"},{"oracle_path":"oracles/S13.expected.json","scenario_id":"S13","scenario_path":"scenarios/S13.json"},{"oracle_path":"oracles/S14.expected.json","scenario_id":"S14","scenario_path":"scenarios/S14.json"},{"oracle_path":"oracles/S15.expected.json","scenario_id":"S15","scenario_path":"scenarios/S15.json"}],"expected_entry_count":16,"index_only":true,"schema_version":"1.0.0","source_of_truth":"separate input-only scenario files scenarios/S00.json through scenarios/S15.json"}
